{
  "$schema": "./elements.schema.json",
  "version": "3.0.0",
  "description": "Single Source of Truth for all element definitions in Particula - Phase 2 Newtonian Physics",
  
  "flags": {
    "FLAG_NONE":           0,
    "FLAG_FLAMMABLE":      1,
    "FLAG_CONDUCTIVE":     2,
    "FLAG_LIQUID":         4,
    "FLAG_GAS":            8,
    "FLAG_POWDER":        16,
    "FLAG_SOLID":         32,
    "FLAG_ENERGY":        64,
    "FLAG_UTILITY":      128,
    "FLAG_BIO":          256,
    "FLAG_IGNORE_GRAVITY": 512,
    "FLAG_CORROSIVE":   1024,
    "FLAG_HOT":         2048,
    "FLAG_COLD":        4096,
    "FLAG_RIGID":       8192
  },
  
  "physics": {
    "gravity": 0.5,
    "airFriction": 0.98,
    "maxVelocity": 10.0
  },
  
  "categories": [
    { "id": 0, "name": "solid",   "rustName": "CAT_SOLID" },
    { "id": 1, "name": "powder",  "rustName": "CAT_POWDER" },
    { "id": 2, "name": "liquid",  "rustName": "CAT_LIQUID" },
    { "id": 3, "name": "gas",     "rustName": "CAT_GAS" },
    { "id": 4, "name": "energy",  "rustName": "CAT_ENERGY" },
    { "id": 5, "name": "utility", "rustName": "CAT_UTILITY" },
    { "id": 6, "name": "bio",     "rustName": "CAT_BIO" }
  ],
  
  "elements": [
    {
      "id": 0,
      "name": "empty",
      "rustName": "EL_EMPTY",
      "category": "solid",
      "color": "0xFF0A0A0A",
      "density": 0.0,
      "dispersion": 0,
      "lifetime": 0,
      "defaultTemp": 20.0,
      "heatConductivity": 5,
      "flammable": false,
      "conductive": false,
      "hidden": true
    },
    {
      "id": 1,
      "name": "stone",
      "rustName": "EL_STONE",
      "category": "solid",
      "color": "0xFF808080",
      "density": 2500.0,
      "dispersion": 0,
      "lifetime": 0,
      "defaultTemp": 20.0,
      "heatConductivity": 10,
      "flammable": false,
      "conductive": false,
      "phaseChange": { "high": { "temp": 900.0, "to": "lava" } }
    },
    {
      "id": 2,
      "name": "sand",
      "rustName": "EL_SAND",
      "category": "powder",
      "color": "0xFFC2B280",
      "density": 1600.0,
      "dispersion": 0,
      "lifetime": 0,
      "defaultTemp": 20.0,
      "heatConductivity": 15,
      "flammable": false,
      "conductive": false,
      "phaseChange": { "high": { "temp": 1700.0, "to": "lava" } }
    },
    {
      "id": 3,
      "name": "wood",
      "rustName": "EL_WOOD",
      "category": "solid",
      "color": "0xFF8B4513",
      "density": 600.0,
      "dispersion": 0,
      "lifetime": 0,
      "defaultTemp": 20.0,
      "heatConductivity": 5,
      "flammable": true,
      "conductive": false
    },
    {
      "id": 4,
      "name": "metal",
      "rustName": "EL_METAL",
      "category": "solid",
      "color": "0xFFA9A9A9",
      "density": 7800.0,
      "dispersion": 0,
      "lifetime": 0,
      "defaultTemp": 20.0,
      "heatConductivity": 90,
      "flammable": false,
      "conductive": true,
      "phaseChange": { "high": { "temp": 1500.0, "to": "lava" } }
    },
    {
      "id": 5,
      "name": "ice",
      "rustName": "EL_ICE",
      "category": "solid",
      "color": "0xFFA5F2F3",
      "density": 916.0,
      "dispersion": 0,
      "lifetime": 0,
      "defaultTemp": -10.0,
      "heatConductivity": 20,
      "flammable": false,
      "conductive": false,
      "phaseChange": { "high": { "temp": 0.0, "to": "water" } }
    },
    {
      "id": 6,
      "name": "water",
      "rustName": "EL_WATER",
      "category": "liquid",
      "color": "0xFF4169E1",
      "density": 1000.0,
      "dispersion": 4,
      "lifetime": 0,
      "defaultTemp": 20.0,
      "heatConductivity": 40,
      "flammable": false,
      "conductive": true,
      "phaseChange": {
        "high": { "temp": 100.0, "to": "steam" },
        "low": { "temp": 0.0, "to": "ice" }
      }
    },
    {
      "id": 7,
      "name": "oil",
      "rustName": "EL_OIL",
      "category": "liquid",
      "color": "0xFF4A4A2A",
      "density": 800.0,
      "dispersion": 5,
      "lifetime": 0,
      "defaultTemp": 20.0,
      "heatConductivity": 15,
      "flammable": true,
      "conductive": false
    },
    {
      "id": 8,
      "name": "lava",
      "rustName": "EL_LAVA",
      "category": "liquid",
      "color": "0xFFFF4500",
      "density": 2500.0,
      "dispersion": 2,
      "lifetime": 0,
      "defaultTemp": 1000.0,
      "heatConductivity": 30,
      "flammable": false,
      "conductive": false,
      "phaseChange": { "low": { "temp": 700.0, "to": "stone" } }
    },
    {
      "id": 9,
      "name": "acid",
      "rustName": "EL_ACID",
      "category": "liquid",
      "color": "0xFF39FF14",
      "density": 1050.0,
      "dispersion": 5,
      "lifetime": 0,
      "defaultTemp": 20.0,
      "heatConductivity": 35,
      "flammable": false,
      "conductive": true
    },
    {
      "id": 10,
      "name": "steam",
      "rustName": "EL_STEAM",
      "category": "gas",
      "color": "0xB4E0E0E0",
      "density": 0.6,
      "dispersion": 6,
      "lifetime": 0,
      "defaultTemp": 100.0,
      "heatConductivity": 10,
      "flammable": false,
      "conductive": false,
      "phaseChange": { "low": { "temp": 90.0, "to": "water" } }
    },
    {
      "id": 11,
      "name": "smoke",
      "rustName": "EL_SMOKE",
      "category": "gas",
      "color": "0xC83F3F3F",
      "density": 1.1,
      "dispersion": 4,
      "lifetime": 0,
      "defaultTemp": 50.0,
      "heatConductivity": 5,
      "flammable": false,
      "conductive": false
    },
    {
      "id": 12,
      "name": "fire",
      "rustName": "EL_FIRE",
      "category": "energy",
      "color": "0xFFFF6600",
      "density": 0.3,
      "dispersion": 0,
      "lifetime": 60,
      "defaultTemp": 800.0,
      "heatConductivity": 50,
      "flammable": false,
      "conductive": false
    },
    {
      "id": 13,
      "name": "spark",
      "rustName": "EL_SPARK",
      "category": "energy",
      "color": "0xFFFFFF00",
      "density": 0.1,
      "dispersion": 0,
      "lifetime": 10,
      "defaultTemp": 500.0,
      "heatConductivity": 50,
      "flammable": false,
      "conductive": false
    },
    {
      "id": 14,
      "name": "electricity",
      "rustName": "EL_ELECTRICITY",
      "category": "energy",
      "color": "0xFF00FFFF",
      "density": 0.0,
      "dispersion": 0,
      "lifetime": 3,
      "defaultTemp": 200.0,
      "heatConductivity": 80,
      "flammable": false,
      "conductive": false
    },
    {
      "id": 15,
      "name": "gunpowder",
      "rustName": "EL_GUNPOWDER",
      "category": "powder",
      "color": "0xFF404040",
      "density": 1400.0,
      "dispersion": 0,
      "lifetime": 0,
      "defaultTemp": 20.0,
      "heatConductivity": 10,
      "flammable": true,
      "conductive": false
    },
    {
      "id": 16,
      "name": "clone",
      "rustName": "EL_CLONE",
      "category": "utility",
      "color": "0xFF00FF00",
      "density": "Infinity",
      "dispersion": 0,
      "lifetime": 0,
      "defaultTemp": 20.0,
      "heatConductivity": 0,
      "flammable": false,
      "conductive": false
    },
    {
      "id": 17,
      "name": "void",
      "rustName": "EL_VOID",
      "category": "utility",
      "color": "0xFF000000",
      "density": "Infinity",
      "dispersion": 0,
      "lifetime": 0,
      "defaultTemp": 20.0,
      "heatConductivity": 0,
      "flammable": false,
      "conductive": false
    },
    {
      "id": 18,
      "name": "dirt",
      "rustName": "EL_DIRT",
      "category": "powder",
      "color": "0xFF5C4033",
      "density": 1200.0,
      "dispersion": 0,
      "lifetime": 0,
      "defaultTemp": 20.0,
      "heatConductivity": 10,
      "flammable": false,
      "conductive": false
    },
    {
      "id": 19,
      "name": "seed",
      "rustName": "EL_SEED",
      "category": "bio",
      "color": "0xFFE2C489",
      "density": 1100.0,
      "dispersion": 0,
      "lifetime": 0,
      "defaultTemp": 20.0,
      "heatConductivity": 5,
      "flammable": true,
      "conductive": false
    },
    {
      "id": 20,
      "name": "plant",
      "rustName": "EL_PLANT",
      "category": "bio",
      "color": "0xFF228B22",
      "density": 900.0,
      "dispersion": 0,
      "lifetime": 0,
      "defaultTemp": 20.0,
      "heatConductivity": 10,
      "flammable": true,
      "conductive": false
    }
  ]
}
